<?xml version="1.0" encoding="UTF-8"?>
<!DOCTYPE irprotocol PUBLIC "-//bengt-martensson.de//irprotocols//en"
 "../dtds/irprotocols.dtd">
<irprotocol name="rc5" id="rc5">
  <jp1data>
    <protocol number="00 E8" name="RC5"/>
    <tohex function="reverse-invert" bits="8"/>
  </jp1data>
  <cooked-ccf-string format="5000 0073 0000 0001 %04x %04x">
    <parameterref parameter="deviceno"/>
    <parameterref parameter="cmdno"/>
  </cooked-ccf-string>
  <parameters>
    <parameter id="deviceno" bits="5"/><!-- Philips: system -->
    <parameter id="cmdno" bits="7"/>
    <parameter id="toggle" bits="1"/>
  </parameters>
  <frequency value="36000"/>
  <irpnotation-new>
protocol={36k,889,msb}&lt;1,-1|-1,1>(1:1,~F:1:6,T:1,D:5,F:6,^128)+
user=d,Device
user=f,Function
user=t,Toggle
  </irpnotation-new>
  <body>
    <timings>
      <timing id="t1" cycles="32"/>
      <timing id="ttotal" cycles="4096"/>
    </timings>
    <pairs>
      <pair id="p0">
        <one timing="t1"/>
        <zero timing="t1"/>
      </pair>
      <pair id="p1">
        <zero timing="t1"/>
        <one timing="t1"/>
      </pair>
    </pairs>
    <intro/>
    <repeat>
      <coded_number direction="msb" zero="p0" one="p1" bits="1">
	<constant value="1"/>
      </coded_number>
      <coded_number direction="msb" zero="p0" one="p1" bits="1">
	<complement bits="1">
	  <mask mask="64" shift="-6">
	    <parameterref parameter="cmdno"/>
	  </mask>
	</complement>
      </coded_number>
      <coded_number direction="msb" zero="p0" one="p1" bits="1">
	<parameterref parameter="toggle"/>
      </coded_number>
      <coded_number direction="msb" zero="p0" one="p1" bits="5">
	<parameterref parameter="deviceno"/>
      </coded_number>
      <coded_number direction="msb" zero="p0" one="p1" bits="6">
	<parameterref parameter="cmdno"/>
      </coded_number>
      <zeropadding timing="ttotal"/>
    </repeat>
  </body>
</irprotocol>
